
T:  Bus=01 Lev=00 Prnt=00 Port=00 Cnt=00 Dev#=  1 Spd=480 MxCh= 1
D:  Ver= 2.00 Cls=09(hub  ) Sub=00 Prot=01 MxPS=64 #Cfgs=  1
P:  Vendor=1d6b ProdID=0002 Rev=04.19
S:  Manufacturer=Linux 4.19.66-v7+ dwc_otg_hcd
S:  Product=DWC OTG Controller
S:  SerialNumber=3f980000.usb
C:  #Ifs= 1 Cfg#= 1 Atr=e0 MxPwr=0mA
I:  If#= 0 Alt= 0 #EPs= 1 Cls=09(hub  ) Sub=00 Prot=00 Driver=hub

T:  Bus=01 Lev=01 Prnt=01 Port=00 Cnt=01 Dev#=  2 Spd=480 MxCh= 4
D:  Ver= 2.00 Cls=09(hub  ) Sub=00 Prot=02 MxPS=64 #Cfgs=  1
P:  Vendor=0424 ProdID=2514 Rev=0b.b3
C:  #Ifs= 1 Cfg#= 1 Atr=e0 MxPwr=2mA
I:  If#= 0 Alt= 1 #EPs= 1 Cls=09(hub  ) Sub=00 Prot=02 Driver=hub

T:  Bus=01 Lev=02 Prnt=02 Port=00 Cnt=01 Dev#=  3 Spd=480 MxCh= 3
D:  Ver= 2.00 Cls=09(hub  ) Sub=00 Prot=02 MxPS=64 #Cfgs=  1
P:  Vendor=0424 ProdID=2514 Rev=0b.b3
C:  #Ifs= 1 Cfg#= 1 Atr=e0 MxPwr=2mA
I:  If#= 0 Alt= 1 #EPs= 1 Cls=09(hub  ) Sub=00 Prot=02 Driver=hub

T:  Bus=01 Lev=03 Prnt=03 Port=00 Cnt=01 Dev#=  8 Spd=480 MxCh= 0
D:  Ver= 2.10 Cls=ff(vend.) Sub=00 Prot=ff MxPS=64 #Cfgs=  1
P:  Vendor=0424 ProdID=7800 Rev=03.00
C:  #Ifs= 1 Cfg#= 1 Atr=e0 MxPwr=2mA
I:  If#= 0 Alt= 0 #EPs= 3 Cls=ff(vend.) Sub=00 Prot=ff Driver=lan78xx

T:  Bus=01 Lev=03 Prnt=03 Port=01 Cnt=02 Dev#=  5 Spd=12  MxCh= 3
D:  Ver= 1.10 Cls=09(hub  ) Sub=00 Prot=00 MxPS= 8 #Cfgs=  1
P:  Vendor=413c ProdID=1003 Rev=02.00
S:  Manufacturer=Dell
S:  Product=Dell USB Keyboard Hub
C:  #Ifs= 1 Cfg#= 1 Atr=a0 MxPwr=100mA
I:  If#= 0 Alt= 0 #EPs= 1 Cls=09(hub  ) Sub=00 Prot=00 Driver=hub

T:  Bus=01 Lev=04 Prnt=05 Port=00 Cnt=01 Dev#=  7 Spd=12  MxCh= 0
D:  Ver= 1.10 Cls=00(>ifc ) Sub=00 Prot=00 MxPS= 8 #Cfgs=  1
P:  Vendor=413c ProdID=2010 Rev=02.00
S:  Manufacturer=Dell
S:  Product=Dell USB Keyboard
C:  #Ifs= 2 Cfg#= 1 Atr=a0 MxPwr=50mA
I:  If#= 0 Alt= 0 #EPs= 1 Cls=03(HID  ) Sub=01 Prot=01 Driver=usbhid
I:  If#= 1 Alt= 0 #EPs= 1 Cls=03(HID  ) Sub=00 Prot=00 Driver=usbhid

T:  Bus=01 Lev=03 Prnt=03 Port=02 Cnt=03 Dev#=  6 Spd=1.5 MxCh= 0
D:  Ver= 2.00 Cls=00(>ifc ) Sub=00 Prot=00 MxPS= 8 #Cfgs=  1
P:  Vendor=046d ProdID=c077 Rev=67.00
S:  Manufacturer=Logitech
S:  Product=USB Optical Mouse
C:  #Ifs= 1 Cfg#= 1 Atr=a0 MxPwr=98mA
I:  If#= 0 Alt= 0 #EPs= 1 Cls=03(HID  ) Sub=01 Prot=02 Driver=usbhid

T:  Bus=01 Lev=02 Prnt=02 Port=02 Cnt=02 Dev#=  4 Spd=480 MxCh= 0
D:  Ver= 2.10 Cls=00(>ifc ) Sub=00 Prot=00 MxPS=64 #Cfgs=  1
P:  Vendor=2357 ProdID=0109 Rev=02.00
S:  Manufacturer=Realtek 
S:  Product=802.11n NIC 
S:  SerialNumber=00e04c000001
C:  #Ifs= 1 Cfg#= 1 Atr=e0 MxPwr=500mA
I:  If#= 0 Alt= 0 #EPs= 5 Cls=ff(vend.) Sub=ff Prot=ff Driver=rtl8192eu
